Title,Category,Price,Product Code/ SKU,Short Description,Long Description,How to Use,Active Ingredients,Product URLSprilon Spray 115g,Health,19.95,400286,"Sprilon is ideal for the prevention and treatment of pressure sores and skin damage from contact with body fluids. It can also be used for the protection and treatment of nappy rash, fissures, leg ulcers and the protection of skin beneath plaster casts in an easy-to-use spray format.","Non-irritant, protective, water-repellent, spray ointment. With zinc oxide and dimeticone, Sprilon Spray provides an excellent soothing barrier for your skin.  Like all medicines, Sprilon can cause side effects, although not everybody gets them. Stop using and talk to your pharmacist or doctor if you develop an allergic reaction, you experience local skin irritation or if your condition gets worse.",Shake can well. Spray from 20cm away and at a right angle. Gently press the nozzle to apply a thin even layer. 2-3 seconds of spraying should be enough to cover an area the size of the buttocks.,"Zinc Oxide 12.5% w/w, Dimeticone 1.04% w/w",https://www.inishpharmacy.com/p/sprilon-spray-115g/400286
Medicare Paediatric Urine Collector Bag 160ml MD409,Health->Continence Care,0.95,150428,The Medicare Paediatric Urine Collector bag is transparent and can hold up to 160ml.,,,,https://www.inishpharmacy.com/p/medicare-paediatric-urine-collector-bag-160ml-md409/150428
Malem Universal Wireless Alarm MO15,Health->Continence Care->Bedwetting Alarms,249.95,M015,"Malem Universal Wireless Alarm MO15    Wireless 64 Channels Auto Tuning  One small portable Receiver will monitor and identify up to seven Transmitters  Each Transmitter can be attached to avariety of sensors  Can be used for Enuresis, Incontinence, Wandering and Sleepwalking  Ideal for Nursing/Care Homes, Special Schools, Institutions and Individuals","Malem Enuresis Alarms (bedwetting alarms) are designed to maximize success in the treatment and cure of bedwetting and provide a safe, efficient, economical and permanent cure for bedwetting.  Bedwetting, or nocturnal enuresis, is a very common problem. It is very distressing and deserves to be treated. It can affect anyone and as many as 10% of 5 year olds, 5% of 10 year olds and 2% of adults suffer unnecessarily. As many as 40% of the elderly may suffer from incontinence.  The Malem Bedwetting Alarm consists of a safe electronic device contained in a small, ultra lightweight plastic box which is comfortably and discreetly worn on the nightwear top close to the collar bone. The alarm is connected to a sensor which detects urination. When urination commences and the sensor is moistened, the alarm is triggered and a stimulus is activated. This can be in the form of a loud sound, vibration or light (depending on theMalem Bedwetting Alarm model purchased). The Easy-Clip, Standard or Bed-Mat sensors can all be linked to any of the alarms.  Repetitive awakening by the Alarm as soon as urination commences will gradually train the brain to exert automatic control over the bladder. Eventually, the bedwetter will either wake up before urination or be cured resulting in them sleeping throughout the night without needing to empty the bladder.",,,https://www.inishpharmacy.com/p/malem-universal-wireless-alarm-mo15/m015
Malem Enuresis Bedwetting Alarm Ultimate Pink Sound 1 With Easy Clip MO4,Health->Continence Care->Bedwetting Alarms,119.95,M04PINK,"Malem Enuresis Alarm Ultimate Pink Sound 1 With Easy Clip MO4 is designed to maximise effectiveness by providing a selectable combination of sound(s) and/or vibration to suit the needs of the user.   Comfortable, compact and light-weight  Easy to set up and use  Can be used with any pair of underpants  Transmitter magnetically clips to the underpants’ waistband  Uses Malem’s famous unisex Easy-Clip sensor  Ergonomically designed smart, colourful, compact (53 x 50 x 17mm)  Lightweight (53g including 2 x AAA batteries)","Malem Enuresis Alarms (bedwetting alarms) are designed to maximize success in the treatment and cure of bedwetting and provide a safe, efficient, economical and permanent cure for bedwetting.  Bedwetting, or nocturnal enuresis, is a very common problem. It is very distressing and deserves to be treated. It can affect anyone and as many as 10% of 5 year olds, 5% of 10 year olds and 2% of adults suffer unnecessarily. As many as 40% of the elderly may suffer from incontinence.  The Malem Bedwetting Alarm consists of a safe electronic device contained in a small, ultra lightweight plastic box which is comfortably and discreetly worn on the nightwear top close to the collar bone. The alarm is connected to a sensor which detects urination. When urination commences and the sensor is moistened, the alarm is triggered and a stimulus is activated. This can be in the form of a loud sound, vibration or light (depending on theMalem Bedwetting Alarm model purchased). The Easy-Clip, Standard or Bed-Mat sensors can all be linked to any of the alarms.  Repetitive awakening by the Alarm as soon as urination commences will gradually train the brain to exert automatic control over the bladder. Eventually, the bedwetter will either wake up before urination or be cured resulting in them sleeping throughout the night without needing to empty the bladder.",,,https://www.inishpharmacy.com/p/malem-enuresis-bedwetting-alarm-ultimate-pink-sound-1-with-easy-clip-mo4/m04pink
Malem Enuresis Bedwetting Alarm Yellow Eight Tone With Easy Clip MO3,Health->Continence Care->Bedwetting Alarms,89.95,M03YELLOW,"Malem Enuresis Alarm Yellow Eight Tone With Easy Clip M03   Comfortable, compact and light-weight  Easy to set up and use  Can be used with any pair of underpants  Transmitter magnetically clips to the underpants’ waistband  Uses Malem’s famous unisex Easy-Clip sensor","Malem Enuresis Alarms (bedwetting alarms) are designed to maximize success in the treatment and cure of bedwetting and provide a safe, efficient, economical and permanent cure for bedwetting.  Bedwetting, or nocturnal enuresis, is a very common problem. It is very distressing and deserves to be treated. It can affect anyone and as many as 10% of 5 year olds, 5% of 10 year olds and 2% of adults suffer unnecessarily. As many as 40% of the elderly may suffer from incontinence.  The Malem Bedwetting Alarm consists of a safe electronic device contained in a small, ultra lightweight plastic box which is comfortably and discreetly worn on the nightwear top close to the collar bone. The alarm is connected to a sensor which detects urination. When urination commences and the sensor is moistened, the alarm is triggered and a stimulus is activated. This can be in the form of a loud sound, vibration or light (depending on theMalem Bedwetting Alarm model purchased). The Easy-Clip, Standard or Bed-Mat sensors can all be linked to any of the alarms.  Repetitive awakening by the Alarm as soon as urination commences will gradually train the brain to exert automatic control over the bladder. Eventually, the bedwetter will either wake up before urination or be cured resulting in them sleeping throughout the night without needing to empty the bladder.",,,https://www.inishpharmacy.com/p/malem-enuresis-bedwetting-alarm-yellow-eight-tone-with-easy-clip-mo3/m03yellow
Malem Medical Vibro Watch Black MO10,Health->Continence Care->Bedwetting Alarms,91.95,M010BLACK,Malem Medical Vibrating Alarm Watch Black MO10   Silent daily reminders  12 Independent Specific-Time Vibrating Alarms  Period Auto-Repeat Vibrating Alarm  Built in memory so that the selected settings do not have to be re-entered after battery change   Can be used for:   Timed Voiding  Bladder Emptying Vibrator Reminder  Medication Vibrating Reminder  Behavioural Modification Programs,"Malem Vibro-Watch is a digital multi-function watch with 12 independent Specific-Time Silent Vibrating Alarms and a Periodic Auto -Repeat Vibrating Alarm (ranging from 1min to 23:59hour) as well as in real time (12/24, am/pm), minute, second, month, date, day of week, hourly vibrating chime(selectable) and a stop watch. Any of the set vibrating alarms can be easily selected or de-selected without changing the set time. Selected Specific-Time alarms or Periodic Auto-Repeat vibrating alarms can be easily activated or de-activated (On or Off).",,,https://www.inishpharmacy.com/p/malem-medical-vibro-watch-black-mo10/m010black
Malem Enuresis Bedwetting Alarm Ultimate Purple Sound 3 With Easy Clip MO4,Health->Continence Care->Bedwetting Alarms,119.95,M04PURPLE,"Malem Enuresis Alarm Ultimate Purple Sound 3 With Easy Clip MO4 is designed to maximise effectiveness by providing a selectable combination of sound(s) and/or vibration to suit the needs of the user.   Comfortable, compact and light-weight  Easy to set up and use  Can be used with any pair of underpants  Transmitter magnetically clips to the underpants’ waistband  Uses Malem’s famous unisex Easy-Clip sensor  Ergonomically designed smart, colourful, compact (53 x 50 x 17mm)  Lightweight (53g including 2 x AAA batteries)","Malem Enuresis Alarms (bedwetting alarms) are designed to maximize success in the treatment and cure of bedwetting and provide a safe, efficient, economical and permanent cure for bedwetting.  Bedwetting, or nocturnal enuresis, is a very common problem. It is very distressing and deserves to be treated. It can affect anyone and as many as 10% of 5 year olds, 5% of 10 year olds and 2% of adults suffer unnecessarily. As many as 40% of the elderly may suffer from incontinence.  The Malem Bedwetting Alarm consists of a safe electronic device contained in a small, ultra lightweight plastic box which is comfortably and discreetly worn on the nightwear top close to the collar bone. The alarm is connected to a sensor which detects urination. When urination commences and the sensor is moistened, the alarm is triggered and a stimulus is activated. This can be in the form of a loud sound, vibration or light (depending on theMalem Bedwetting Alarm model purchased). The Easy-Clip, Standard or Bed-Mat sensors can all be linked to any of the alarms.  Repetitive awakening by the Alarm as soon as urination commences will gradually train the brain to exert automatic control over the bladder. Eventually, the bedwetter will either wake up before urination or be cured resulting in them sleeping throughout the night without needing to empty the bladder.",,,https://www.inishpharmacy.com/p/malem-enuresis-bedwetting-alarm-ultimate-purple-sound-3-with-easy-clip-mo4/m04purple
Malem Enuresis Bedwetting Alarm Ultimate Gold Eight Tone With Easy Clip MO4,Health->Continence Care->Bedwetting Alarms,119.95,M04GOLD,"Malem Enuresis Alarm Ultimate Gold Eight Tone With Easy Clip MO4 is designed to maximise effectiveness by providing a selectable combination of sound(s) and/or vibration to suit the needs of the user.   Comfortable, compact and light-weight  Easy to set up and use  Can be used with any pair of underpants  Transmitter magnetically clips to the underpants’ waistband  Uses Malem’s famous unisex Easy-Clip sensor  Ergonomically designed smart, colourful, compact (53 x 50 x 17mm)  Lightweight (53g including 2 x AAA batteries)","Malem Enuresis Alarms (bedwetting alarms) are designed to maximize success in the treatment and cure of bedwetting and provide a safe, efficient, economical and permanent cure for bedwetting.  Bedwetting, or nocturnal enuresis, is a very common problem. It is very distressing and deserves to be treated. It can affect anyone and as many as 10% of 5 year olds, 5% of 10 year olds and 2% of adults suffer unnecessarily. As many as 40% of the elderly may suffer from incontinence.  The Malem Bedwetting Alarm consists of a safe electronic device contained in a small, ultra lightweight plastic box which is comfortably and discreetly worn on the nightwear top close to the collar bone. The alarm is connected to a sensor which detects urination. When urination commences and the sensor is moistened, the alarm is triggered and a stimulus is activated. This can be in the form of a loud sound, vibration or light (depending on theMalem Bedwetting Alarm model purchased). The Easy-Clip, Standard or Bed-Mat sensors can all be linked to any of the alarms.  Repetitive awakening by the Alarm as soon as urination commences will gradually train the brain to exert automatic control over the bladder. Eventually, the bedwetter will either wake up before urination or be cured resulting in them sleeping throughout the night without needing to empty the bladder.",,,https://www.inishpharmacy.com/p/malem-enuresis-bedwetting-alarm-ultimate-gold-eight-tone-with-easy-clip-mo4/m04gold
Malem Enuresis Bedwetting Alarm Orange Sound 3 With Easy Clip MO3,Health->Continence Care->Bedwetting Alarms,89.95,M03ORANGE,"Malem Enuresis Alarm Orange Sound 3 With Easy Clip M03   Comfortable, compact and light-weight  Easy to set up and use  Can be used with any pair of underpants  Transmitter magnetically clips to the underpants’ waistband  Uses Malem’s famous unisex Easy-Clip sensor","Malem Enuresis Alarms (bedwetting alarms) are designed to maximize success in the treatment and cure of bedwetting and provide a safe, efficient, economical and permanent cure for bedwetting.  Bedwetting, or nocturnal enuresis, is a very common problem. It is very distressing and deserves to be treated. It can affect anyone and as many as 10% of 5 year olds, 5% of 10 year olds and 2% of adults suffer unnecessarily. As many as 40% of the elderly may suffer from incontinence.  The Malem Bedwetting Alarm consists of a safe electronic device contained in a small, ultra lightweight plastic box which is comfortably and discreetly worn on the nightwear top close to the collar bone. The alarm is connected to a sensor which detects urination. When urination commences and the sensor is moistened, the alarm is triggered and a stimulus is activated. This can be in the form of a loud sound, vibration or light (depending on theMalem Bedwetting Alarm model purchased). The Easy-Clip, Standard or Bed-Mat sensors can all be linked to any of the alarms.  Repetitive awakening by the Alarm as soon as urination commences will gradually train the brain to exert automatic control over the bladder. Eventually, the bedwetter will either wake up before urination or be cured resulting in them sleeping throughout the night without needing to empty the bladder.",,,https://www.inishpharmacy.com/p/malem-enuresis-bedwetting-alarm-orange-sound-3-with-easy-clip-mo3/m03orange
Malem Enuresis Bedwetting Alarm Green Sound 2 With Easy Clip MO3,Health->Continence Care->Bedwetting Alarms,89.95,M03GREEN,"Malem Enuresis Alarm Green Sound 2 With Easy Clip M03   Comfortable, compact and light-weight  Easy to set up and use  Can be used with any pair of underpants  Transmitter magnetically clips to the underpants’ waistband  Uses Malem’s famous unisex Easy-Clip sensor","Malem Enuresis Alarms (bedwetting alarms) are designed to maximize success in the treatment and cure of bedwetting and provide a safe, efficient, economical and permanent cure for bedwetting.  Bedwetting, or nocturnal enuresis, is a very common problem. It is very distressing and deserves to be treated. It can affect anyone and as many as 10% of 5 year olds, 5% of 10 year olds and 2% of adults suffer unnecessarily. As many as 40% of the elderly may suffer from incontinence.  The Malem Bedwetting Alarm consists of a safe electronic device contained in a small, ultra lightweight plastic box which is comfortably and discreetly worn on the nightwear top close to the collar bone. The alarm is connected to a sensor which detects urination. When urination commences and the sensor is moistened, the alarm is triggered and a stimulus is activated. This can be in the form of a loud sound, vibration or light (depending on theMalem Bedwetting Alarm model purchased). The Easy-Clip, Standard or Bed-Mat sensors can all be linked to any of the alarms.  Repetitive awakening by the Alarm as soon as urination commences will gradually train the brain to exert automatic control over the bladder. Eventually, the bedwetter will either wake up before urination or be cured resulting in them sleeping throughout the night without needing to empty the bladder.",,,https://www.inishpharmacy.com/p/malem-enuresis-bedwetting-alarm-green-sound-2-with-easy-clip-mo3/m03green
Just A Drop Ostomy Odour Eliminator Lightly Scented 30ml,Health->Continence Care->Odour Control ,5.50,804809460672,Just A Drop Ostomy Odour Eliminator helps to eliminate any odors that can occur when emptying a pouch into the toilet. A few drops are added to the toilet before emptying the pouch. The drops work by trapping odors below the water surface until they are flushed away.,,,,https://www.inishpharmacy.com/p/just-a-drop-ostomy-odour-eliminator-lightly-scented-30ml/804809460672
Tena Pants Flex Large 30 Pack - Belted Slip,Health->Continence Care,33.75,401076,"A belted product that allows for easier, more ergonomic changing and with a comfortable, discreet fit. TENA Flex Plus provides anatomically shaped protection with double absorption cores for leakage security.   Hover mouse over for more information          The Superfit Waist Belt facilitiates quicker and easier changing           TENA Flex incontinence protection has a patented Superfit Waist Belt. Simply fasten the belt around the waist, then fix the front of the pad to the belt using the Hook in Line system. TENA Flex is quicker and easier to change than traditional products regardless of your loved one’s position, ensuring dignity and more ergonomically beneficial for the caregiver.         The breathable material and design help maintain healthy skin           TENA Flex incontinence protection has a fully breathable outer material that allows air to circulate. Moreover, TENA Flex's special design leaves your loved one's hips and thighs less covered. The special design of TENA Flex allows air to circulate around the hips maintaining dryness, healthy skin and wearer comfort.         Fast liquid absorption and a highly absorbent core provide lasting dryness","A stretchy waist belt and all-round elastic ensure a snug fit  Both the ComfiStretch waist belt and the waist band are flexible and stretchy and easily adjust to fit different body shapes. Combined with the curved leg elastics and noise-free textile materials the product provides discreet, safe incontinence protection with a really snug, comfortable fit.    Smart use of materials and high leakage security – a green choice  The incontinence product's design makes more rational use of material. The close anatomical fit reduces leakage risk, in turn decreasing laundry needs.      Leakage barriers for extra security  TENA Flex incontinence protection has high-performance leakage barriers for added protection, whether your loved one is standing, sitting or lying down.      The Odour Neutraliser reduces the effect of ammonia odour  The Odour Neutraliser reduces the effect of ammonia odour, giving your loved one a feeling of freshness and dignity.      Wetness indicator shows when it is time to change  There is no need to open TENA Flex incontinence protection to find out whether it needs changing. The wetness indicator on the outside of the product turns from yellow to blue when it is time to change. Just one look at the TENA Flex wetness indicator will guide you.      Easy Select colour coding indicates absorbency level  The absorbency level is colour coded and the size and fitting illustrations are clearly printed on the incontinence product and the pack for easy identification.",,,https://www.inishpharmacy.com/p/tena-pants-flex-large-30-pack---belted-slip/401076
Tena Pants Flex Medium 30 Pack - Belted Slip,Health->Continence Care,30.50,401075,"A belted product that allows for easier, more ergonomic changing and with a comfortable, discreet fit. TENA Flex Plus provides anatomically shaped protection with double absorption cores for leakage security.       The Superfit Waist Belt facilitiates quicker and easier changing           TENA Flex incontinence protection has a patented Superfit Waist Belt. Simply fasten the belt around the waist, then fix the front of the pad to the belt using the Hook in Line system. TENA Flex is quicker and easier to change than traditional products regardless of your loved one’s position, ensuring dignity and more ergonomically beneficial for the caregiver.         The breathable material and design help maintain healthy skin           TENA Flex incontinence protection has a fully breathable outer material that allows air to circulate. Moreover, TENA Flex's special design leaves your loved one's hips and thighs less covered. The special design of TENA Flex allows air to circulate around the hips maintaining dryness, healthy skin and wearer comfort.         Fast liquid absorption and a highly absorbent core provide lasting dryness","A stretchy waist belt and all-round elastic ensure a snug fit  Both the ComfiStretch waist belt and the waist band are flexible and stretchy and easily adjust to fit different body shapes. Combined with the curved leg elastics and noise-free textile materials the product provides discreet, safe incontinence protection with a really snug, comfortable fit.    Smart use of materials and high leakage security – a green choice  The incontinence product's design makes more rational use of material. The close anatomical fit reduces leakage risk, in turn decreasing laundry needs.      Leakage barriers for extra security  TENA Flex incontinence protection has high-performance leakage barriers for added protection, whether your loved one is standing, sitting or lying down.      The Odour Neutralizer reduces the effect of ammonia odour  The Odour Neutralizer reduces the effect of ammonia odour, giving your loved one a feeling of freshness and dignity.      Wetness indicator shows when it is time to change  There is no need to open TENA Flex incontinence protection to find out whether it needs changing. The wetness indicator on the outside of the product turns from yellow to blue when it is time to change. Just one look at the TENA Flex wetness indicator will guide you.      Easy Select colour coding indicates absorbency level  The absorbency level is colour coded and the size and fitting illustrations are clearly printed on the incontinence product and the pack for easy identification.",,,https://www.inishpharmacy.com/p/tena-pants-flex-medium-30-pack---belted-slip/401075
Tena Pants Maxi Large 10 Pack,Health->Continence Care,20.50,401068,"With ConfioFit you get a thin, anatomically shaped protection which also provides great comfort. TENA Pants Maxi offers extra high protection and keeps you dry, even overnight. They are a preferred choice for good skin health.   Hover mouse over for more information          ConfioFit provides thin comfort and follows the contours of the body         TENA Pants with ConfioFit is an unique design which follows the anatomy of the body, that makes this high security protection slim and more comfortable. TENA Pants with ConfioFit shape to the lines of the body so they are less visible under clothes.         The double leakage barriers provide high ConfioFit leakage security           TENA Pants with ConfioFit have high-performance leakage barriers for excellent protection, whether you are standing, sitting or lying down.         Fast liquid absorption and a highly absorbent core provide lasting dryness",,,,https://www.inishpharmacy.com/p/tena-pants-maxi-large-10-pack/401068
Tena Men Premium Fit Protective Underwear Level 4 Maxi Medium 10 Pack,Health->Continence Care->Pants,11.55,TM6290,"Tena Men Premium Premium Fit Protective Underwear Level 4 Maxi offers a secure absorption zone. This new design includes a boosted dual absorbent core upfront to lock in leaks, as well as making them breathable and flexible. The odour control and cotton-feel material will also ensure comfortability.",,,,https://www.inishpharmacy.com/p/tena-men-premium-fit-protective-underwear-level-4-maxi-medium-10-pack/tm6290
Tena Pants Maxi Medium 10 Pack,Health->Continence Care,20.50,401069,"With ConfioFit you get a thin, anatomically shaped protection which also provides great comfort. TENA Pants Maxi offers extra high protection and keeps you dry, even overnight. They are a preferred choice for good skin health.   Hover mouse over for more information          ConfioFit provides thin comfort and follows the contours of the body         TENA Pants with ConfioFit is an unique design which follows the anatomy of the body, that makes this high security protection slim and more comfortable. TENA Pants with ConfioFit shape to the lines of the body so they are less visible under clothes.         The double leakage barriers provide high ConfioFit leakage security           TENA Pants with ConfioFit have high-performance leakage barriers for excellent protection, whether you are standing, sitting or lying down.         Fast liquid absorption and a highly absorbent core provide lasting dryness",,,,https://www.inishpharmacy.com/p/tena-pants-maxi-medium-10-pack/401069
